{
	"$schema": "http://json-schema.org/draft-07/schema#",
	"$id": "https://emfe/schema/sources.json",
	"title": "Source registry",
	"type": "array",
	"items": {
		"type": "object",
		"additionalProperties": false,
		"required": ["id", "title"],
		"properties": {
			"id": { "type": "string", "pattern": "^[a-z0-9][a-z0-9-]*$" },
			"title": { "type": "string", "minLength": 1 },
			"url": { "type": "string", "format": "uri" },
			"retrieved": { "type": "string", "format": "date" }
		}
	}
}
