[
	{
		"id": "fcc-tofa",
		"title": "FCC/NTIA Table of Frequency Allocations (47 CFR §2.106)",
		"url": "https://www.ecfr.gov/current/title-47/chapter-I/subchapter-A/part-2/subpart-B/section-2.106",
		"retrieved": "2026-06-29"
	},
	{
		"id": "fcc-part97",
		"title": "FCC Part 97 / ARRL Amateur Radio Band Plan",
		"url": "https://www.arrl.org/band-plan",
		"retrieved": "2026-06-26"
	},
	{
		"id": "itu-rr",
		"title": "ITU Radio Regulations: Nomenclature of frequency bands",
		"url": "https://www.itu.int/pub/R-REG-RR",
		"retrieved": "2026-06-26"
	},
	{
		"id": "nasa-ems",
		"title": "NASA Science: Tour of the Electromagnetic Spectrum",
		"url": "https://science.nasa.gov/ems/",
		"retrieved": "2026-06-26"
	},
	{
		"id": "spectrum-holdings",
		"title": "FCC auctions & public carrier/operator spectrum holdings (approximate, national)",
		"url": "https://www.fcc.gov/auctions",
		"retrieved": "2026-06-29"
	},
	{
		"id": "nist-asd",
		"title": "NIST Atomic Spectra Database: emission lines",
		"url": "https://www.nist.gov/pml/atomic-spectra-database",
		"retrieved": "2026-06-29"
	},
	{
		"id": "rp-photonics",
		"title": "RP Photonics Encyclopedia: laser & LED sources",
		"url": "https://www.rp-photonics.com/encyclopedia.html",
		"retrieved": "2026-06-29"
	},
	{
		"id": "fireworks-chem",
		"title": "Compound Interest: The Chemistry of Fireworks",
		"url": "https://www.compoundchem.com/2014/07/03/fireworkscolours/",
		"retrieved": "2026-06-29"
	},
	{
		"id": "schumann-ref",
		"title": "Schumann resonances: parameters (Wikipedia, after Nickolaenko & Hayakawa)",
		"url": "https://en.wikipedia.org/wiki/Schumann_resonances",
		"retrieved": "2026-06-29"
	}
]
